<?xml version="1.0" encoding="UTF-8"?>
<?xml-stylesheet href="marks.xslt" type="text/xsl"?>
<certification xmlns:xsi="http://www.w3.org/2001/XMLSchema-instance" xsi:noNamespaceSchemaLocation="marks.xsd">
    <student>
        <firstname>Иван</firstname>
        <lastname>Иванов</lastname>
        <fathername>Иванович</fathername>
        <faculty>ИТ</faculty>
        <group>5/2</group>
        <marks>
            <mark>
                <subject>ОИАД</subject>
                <value>6</value>
            </mark>
            <mark>
                <subject>Химия</subject>
                <value>8</value>
            </mark>
            <mark>
                <subject>ПВИ</subject>
                <value>10</value>
            </mark>
        </marks>
    </student>
    <student>
        <firstname>Петр</firstname>
        <lastname>Петров</lastname>
        <faculty>ИТ</faculty>
        <group>1/1</group>
        <marks>
            <mark>
                <subject>Химия</subject>
                <value>2</value>
            </mark>
            <mark>
                <subject>ОИАД</subject>
                <value>4</value>
            </mark>
            <mark>
                <subject>ПВИ</subject>
                <value>6</value>
            </mark>
        </marks>
    </student>
    <student>
        <firstname>Сергей</firstname>
        <lastname>Сергеев</lastname>
        <fathername>Сергеевич</fathername>
        <faculty>ЗО</faculty>
        <group>7/1</group>
        <marks>
            <mark>
                <subject>ПВИ</subject>
                <value>4</value>
            </mark>
            <mark>
                <subject>ОИАД</subject>
                <value>8</value>
            </mark>
            <mark>
                <subject>Химия</subject>
                <value>8</value>
            </mark>
        </marks>
    </student>
</certification>